{
  "schemaVersion": "1.0.0",
  "name": "agentic-workflow-guard-ci-pipeline-hardening",
  "version": "1.0.0",
  "description": "Focused CI pipeline rule pack for Bitbucket Pipelines, GitLab CI, Travis CI, Drone CI, TeamCity, Harness CI/CD, Tekton Pipelines, Argo Workflows, AWS CodeBuild, Google Cloud Build, CircleCI, Azure Pipelines, Jenkins, and Buildkite agent jobs.",
  "publisher": "guorunjie",
  "license": "MIT",
  "homepage": "https://github.com/guorunjie/agentic-workflow-guard",
  "compatibility": {
    "cli": ">=1.0.0 <2.0.0",
    "schema": "agentic-workflow-guard-rule-pack@1",
    "ruleIds": "AWI001-AWI002,AWI007-AWI008"
  },
  "platforms": [
    "bitbucket-pipelines",
    "gitlab-ci",
    "travis-ci",
    "drone-ci",
    "teamcity",
    "harness",
    "tekton",
    "argo-workflows",
    "aws-codebuild",
    "google-cloud-build",
    "circleci",
    "azure-pipelines",
    "jenkins",
    "buildkite"
  ],
  "rules": [
    "AWI001",
    "AWI002",
    "AWI007",
    "AWI008"
  ],
  "ruleCount": 4,
  "provenance": {
    "source": "community",
    "repository": "https://github.com/guorunjie/agentic-workflow-guard",
    "releaseTag": "v1.0.0"
  },
  "checksum": "sha256:e1a3412eb4364573207370710bb9249b37c600d669c449ce7daa51c361ca2cf2"
}
