{
  "schemaVersion": "1.0.0",
  "name": "agentic-workflow-guard-github-actions-hardening",
  "version": "1.0.0",
  "description": "Focused GitHub Actions rule pack for prompt-injection, shell-sink, token, pull_request_target, and missing-control risks.",
  "publisher": "guorunjie",
  "license": "MIT",
  "homepage": "https://github.com/guorunjie/agentic-workflow-guard",
  "compatibility": {
    "cli": ">=1.0.0 <2.0.0",
    "schema": "agentic-workflow-guard-rule-pack@1",
    "ruleIds": "AWI001-AWI004,AWI007-AWI008"
  },
  "platforms": [
    "github-actions"
  ],
  "rules": [
    "AWI001",
    "AWI002",
    "AWI003",
    "AWI004",
    "AWI007",
    "AWI008"
  ],
  "ruleCount": 6,
  "provenance": {
    "source": "community",
    "repository": "https://github.com/guorunjie/agentic-workflow-guard",
    "releaseTag": "v1.0.0"
  },
  "checksum": "sha256:b05e6432adf4eae8a0e8f725e3644122e2e98678baa06838312749863dd2784e"
}
